Title,Link,Date,Source,Summary,Term,LanguageQueried
"Torrential rains, flash floods, landslide warnings issued for Punjab as monsoons continue - Arab News PK",https://news.google.com/rss/articles/CBMiWEFVX3lxTFB2WFhJaDlGV0Y3WW95WmZsbFZlX0dma01kUDNrN1U2emNUdFZkbzF1bjFmWGpMN25KZ1FiSXM2VTVsWHJFYW1CUHlFaFBjWGVsZGtHUjVSUnU?oc=5,2025-07-15 10:21:59,Arab News PK,"<a href=""https://news.google.com/rss/articles/CBMiWEFVX3lxTFB2WFhJaDlGV0Y3WW95WmZsbFZlX0dma01kUDNrN1U2emNUdFZkbzF1bjFmWGpMN25KZ1FiSXM2VTVsWHJFYW1CUHlFaFBjWGVsZGtHUjVSUnU?oc=5"" target=""_blank"">Torrential rains, flash floods, landslide warnings issued for Punjab as monsoons continue</a>&nbsp;&nbsp;<font color=""#6f6f6f"">Arab News PK</font>",Monsoon,en
"Torrential rains, flash floods, landslide warnings issued for Punjab as monsoons continue - Arab News",https://news.google.com/rss/articles/CBMiWkFVX3lxTE9kRE9lbzNwOWY1ck1wZEpZS1F3RHR4NGg0V1hNa3ZxaUJpWVJkZHRDMF9yeGJwSzM1UnJMaG1yWV9wT29wT3ByTU5qcWF2NWo4bUVDbUJMUzBJQQ?oc=5,2025-07-15 10:21:59,Arab News,"<a href=""https://news.google.com/rss/articles/CBMiWkFVX3lxTE9kRE9lbzNwOWY1ck1wZEpZS1F3RHR4NGg0V1hNa3ZxaUJpWVJkZHRDMF9yeGJwSzM1UnJMaG1yWV9wT29wT3ByTU5qcWF2NWo4bUVDbUJMUzBJQQ?oc=5"" target=""_blank"">Torrential rains, flash floods, landslide warnings issued for Punjab as monsoons continue</a>&nbsp;&nbsp;<font color=""#6f6f6f"">Arab News</font>",Monsoon,en
"No flood-like situation in Punjab, water level in dams within safe limits: Minister - Press Trust of India",https://news.google.com/rss/articles/CBMiyAFBVV95cUxPMzd4Z2lqc3dzUG5BWHh0MFFpQTFnNmEyLV9qdEYzaWtGZHVHN0dDaDFEbXppT0xyaG5ROEdrYXp1UFFqXzBXWC14RlVsb0tkRDQ0Z2dMQ0dpRlo3dUg5YVlEZVJJMWxNdVhwSmtYRlNvUUY5OTJQVGR3TU1Qc0hVT2lkNjJ0Y2pnZmxwb2U2REhRcEI0Z2VrSFR3X2lldHZyTE5PTnF4U291R19pUHRIX21sX01pbFluVFA2aGt3VU1hQllBX0J1Yg?oc=5,2025-07-15 07:51:21,Press Trust of India,"<a href=""https://news.google.com/rss/articles/CBMiyAFBVV95cUxPMzd4Z2lqc3dzUG5BWHh0MFFpQTFnNmEyLV9qdEYzaWtGZHVHN0dDaDFEbXppT0xyaG5ROEdrYXp1UFFqXzBXWC14RlVsb0tkRDQ0Z2dMQ0dpRlo3dUg5YVlEZVJJMWxNdVhwSmtYRlNvUUY5OTJQVGR3TU1Qc0hVT2lkNjJ0Y2pnZmxwb2U2REhRcEI0Z2VrSFR3X2lldHZyTE5PTnF4U291R19pUHRIX21sX01pbFluVFA2aGt3VU1hQllBX0J1Yg?oc=5"" target=""_blank"">No flood-like situation in Punjab, water level in dams within safe limits: Minister</a>&nbsp;&nbsp;<font color=""#6f6f6f"">Press Trust of India</font>",Monsoon,en
"Heavy Rain: पंजाब में भारी बारिश का Alert, जानें कैसा रहेगा मौसम का हाल - Punjab Kesari",https://news.google.com/rss/articles/CBMiggFBVV95cUxPdDNLZ2ttajhYcDJpSlNCWl9QUEt2b0FfWVVhcHRtUEFXaEZ3T3FOUmpmV21WMGVudWc0R2FWUW1xTFRSc3o3RTY1bUQ1cUJZbVBXRnF4QkRndkdOeEhGN1dkdWwzbF9RVHdBTVFJeFpwM2JQMTNkcWxqMGZRQV9oZUVR0gGHAUFVX3lxTE41STA3aTZ3ODlYMTdGMTZWQ1dEUzNWblc5ME1XVXhxeldtYTZiNWlZejdGb0x6NDFRbkxaUGhNbWYwakRUZm5NLUFDdHVIWWFZWW9BSV9IbXlWRmhPMnFtRWF2NW9SSU0xdlh2X19yeXZqZFktMHlyRUJLdWVEYWNvNWgwQTI5QQ?oc=5,2025-07-15 09:25:33,Punjab Kesari,"<a href=""https://news.google.com/rss/articles/CBMiggFBVV95cUxPdDNLZ2ttajhYcDJpSlNCWl9QUEt2b0FfWVVhcHRtUEFXaEZ3T3FOUmpmV21WMGVudWc0R2FWUW1xTFRSc3o3RTY1bUQ1cUJZbVBXRnF4QkRndkdOeEhGN1dkdWwzbF9RVHdBTVFJeFpwM2JQMTNkcWxqMGZRQV9oZUVR0gGHAUFVX3lxTE41STA3aTZ3ODlYMTdGMTZWQ1dEUzNWblc5ME1XVXhxeldtYTZiNWlZejdGb0x6NDFRbkxaUGhNbWYwakRUZm5NLUFDdHVIWWFZWW9BSV9IbXlWRmhPMnFtRWF2NW9SSU0xdlh2X19yeXZqZFktMHlyRUJLdWVEYWNvNWgwQTI5QQ?oc=5"" target=""_blank"">Heavy Rain: पंजाब में भारी बारिश का Alert, जानें कैसा रहेगा मौसम का हाल</a>&nbsp;&nbsp;<font color=""#6f6f6f"">Punjab Kesari</font>",Monsoon,hi
"पंजाब में सावन के पहले सोमवार को जमकर बरसा मानसून, तापमान में 4 डिग्री तक गिरावट; दो दिनों तक भारी वर्षा का अलर्ट - Punjab Monsoon News Heavy Rains and Temperature Drop Across Districts - Jagran",https://news.google.com/rss/articles/CBMivwFBVV95cUxNMmc2RDhxY201cDM0VExMbGtiWDJ3blB3MHBxR0FmWGstTmhYZWdKLUJMR19GNUpNZDF6M1FkQUdjU3gzWnRwYXFJdzFHa2ZpXzIyQ0pJVjY4ZjZMYjJ0Njlvd01Fd1hoSFBBN2R0WWxRZHJGLXV1ZU4xYlg4NHBINWVqR2RuYkRsWE1UMnJHYm1NeF9LcG9jbWpHRXp2WUNNV2lRUUZyQnRQUzBhcDFlNUxBbVFJbGVRVkN3Ym1Bdw?oc=5,2025-07-15 08:27:00,Jagran,"<a href=""https://news.google.com/rss/articles/CBMivwFBVV95cUxNMmc2RDhxY201cDM0VExMbGtiWDJ3blB3MHBxR0FmWGstTmhYZWdKLUJMR19GNUpNZDF6M1FkQUdjU3gzWnRwYXFJdzFHa2ZpXzIyQ0pJVjY4ZjZMYjJ0Njlvd01Fd1hoSFBBN2R0WWxRZHJGLXV1ZU4xYlg4NHBINWVqR2RuYkRsWE1UMnJHYm1NeF9LcG9jbWpHRXp2WUNNV2lRUUZyQnRQUzBhcDFlNUxBbVFJbGVRVkN3Ym1Bdw?oc=5"" target=""_blank"">पंजाब में सावन के पहले सोमवार को जमकर बरसा मानसून, तापमान में 4 डिग्री तक गिरावट; दो दिनों तक भारी वर्षा का अलर्ट - Punjab Monsoon News Heavy Rains and Temperature Drop Across Districts</a>&nbsp;&nbsp;<font color=""#6f6f6f"">Jagran</font>",Monsoon,hi
