Title,Link,Date,Source,Summary,Term,LanguageQueried
"Maharashtra Weather Update: IMD Predicts Rain, Thunderstorms in Mumbai, Pune Till June 10; Northeast, Vidarbha, Marathwada on Alert - PUNE PULSE",https://news.google.com/rss/articles/CBMi6gFBVV95cUxQYnFqTUxqWHMySlhXMk13NGJ3Sy1xUExCdXd0cm56MFBTNDFzbm1vU2MzeVN5aXFSdXV5UGhOb3JoNU5DVzEtcnNweVAxN0JpUzhPVU9FUmdnOWhVLUVmenlnNXd1OGhoX2JQSDVlSVBVVzdLQlQ4UDFGeHFQdzV3eGVnMzlZWXNMQjZGa19NYUVQTmZFVTdhbFdHWFpfWC02bXJvVzRqbkZmaHdoc2R2MkgzRnpIMmRseWJvcUtfelM1Ml9nY1R2eXRRLXpwM2RsNlJFTk5sclNoZk0zdWhSQ2FpM2JFa1FubVE?oc=5,2025-06-07 13:22:35,PUNE PULSE,"<a href=""https://news.google.com/rss/articles/CBMi6gFBVV95cUxQYnFqTUxqWHMySlhXMk13NGJ3Sy1xUExCdXd0cm56MFBTNDFzbm1vU2MzeVN5aXFSdXV5UGhOb3JoNU5DVzEtcnNweVAxN0JpUzhPVU9FUmdnOWhVLUVmenlnNXd1OGhoX2JQSDVlSVBVVzdLQlQ4UDFGeHFQdzV3eGVnMzlZWXNMQjZGa19NYUVQTmZFVTdhbFdHWFpfWC02bXJvVzRqbkZmaHdoc2R2MkgzRnpIMmRseWJvcUtfelM1Ml9nY1R2eXRRLXpwM2RsNlJFTk5sclNoZk0zdWhSQ2FpM2JFa1FubVE?oc=5"" target=""_blank"">Maharashtra Weather Update: IMD Predicts Rain, Thunderstorms in Mumbai, Pune Till June 10; Northeast, Vidarbha, Marathwada on Alert</a>&nbsp;&nbsp;<font color=""#6f6f6f"">PUNE PULSE</font>",Monsoon,en
"Rajasthan Weather: Temperatures will rise in Rajasthan, when will the monsoon arrive? Know update - Times Bull",https://news.google.com/rss/articles/CBMiswFBVV95cUxNbmNIS09qRVV5TFNXSWhpTUFVT3dMLWs5Ty1fZlF6dHRpRmJleUFfcUFReW1lMmhZdGFNWnhZLURlWm9FcEdBVjE1LTNsd1VjTDBQdDIwWXpQNGtBLXBmeEQ4b3BVSW8zZXFaNlBQZGF4RnpNNTd3UkpDaDZjU281RnhJTUhQeGNLVjNJUG92eHh1cXkwQWFMY3BRQ2pXY0tVLXZfZjZfaTlHS3ZmbjY5MzM3OA?oc=5,2025-06-07 09:18:59,Times Bull,"<a href=""https://news.google.com/rss/articles/CBMiswFBVV95cUxNbmNIS09qRVV5TFNXSWhpTUFVT3dMLWs5Ty1fZlF6dHRpRmJleUFfcUFReW1lMmhZdGFNWnhZLURlWm9FcEdBVjE1LTNsd1VjTDBQdDIwWXpQNGtBLXBmeEQ4b3BVSW8zZXFaNlBQZGF4RnpNNTd3UkpDaDZjU281RnhJTUhQeGNLVjNJUG92eHh1cXkwQWFMY3BRQ2pXY0tVLXZfZjZfaTlHS3ZmbjY5MzM3OA?oc=5"" target=""_blank"">Rajasthan Weather: Temperatures will rise in Rajasthan, when will the monsoon arrive? Know update</a>&nbsp;&nbsp;<font color=""#6f6f6f"">Times Bull</font>",Monsoon,en
Heavy Rainfall Brings Chaos To Southern And Eastern India; Maharashtra Gears Up For More Rain- Check Full IMD Forecast - MSN,https://news.google.com/rss/articles/CBMi-AFBVV95cUxQclNrLXVZRXNzRnl3cTdlWG5wamZ4bS1qTDk4SGZPcUM3QWEza3MtZ0lmMm5sZUl3aXMxeDNzZG1qYno5OVV6akxfSEEwbkE4U0JjNnZSUW02dHRBb2lGLTJPRUlyN2V2VnM0WHVlSmFweHpHdGRXUmhzdEVNQlN1bkJkS0RjSERLSEhEVzVxeERxaUNMdW1CS2xZTVg4dUY5OXJ3Qzdvb1FsT0xpakhPcUw1SXl1czl0eDBzWTcta05Qbnczc1VLSll4bnNSWG9sVHFzbUdMRXFReU42Uk5tcllYdmZuNkVUcE9KcEdyck43SnNSUEI3Mw?oc=5,2025-06-07 07:20:46,MSN,"<a href=""https://news.google.com/rss/articles/CBMi-AFBVV95cUxQclNrLXVZRXNzRnl3cTdlWG5wamZ4bS1qTDk4SGZPcUM3QWEza3MtZ0lmMm5sZUl3aXMxeDNzZG1qYno5OVV6akxfSEEwbkE4U0JjNnZSUW02dHRBb2lGLTJPRUlyN2V2VnM0WHVlSmFweHpHdGRXUmhzdEVNQlN1bkJkS0RjSERLSEhEVzVxeERxaUNMdW1CS2xZTVg4dUY5OXJ3Qzdvb1FsT0xpakhPcUw1SXl1czl0eDBzWTcta05Qbnczc1VLSll4bnNSWG9sVHFzbUdMRXFReU42Uk5tcllYdmZuNkVUcE9KcEdyck43SnNSUEI3Mw?oc=5"" target=""_blank"">Heavy Rainfall Brings Chaos To Southern And Eastern India; Maharashtra Gears Up For More Rain- Check Full IMD Forecast</a>&nbsp;&nbsp;<font color=""#6f6f6f"">MSN</font>",Monsoon,en
Monsoon Update: Meteorological Department issued heavy rain warning in 12 states - Times Bull,https://news.google.com/rss/articles/CBMiswFBVV95cUxNbld6WXJIWldlQ281UVR4V2l6YXFuWU1GZUpaM00wOWdBRjd4MGszTmxySkpFdWJ5RjFDQS1tc0VvSXJnUGtnUTNMbnY0c3VDTXFMVGExbjdiUTFZS2xhZkM0bTBKU3dHdHk4b3JGbmc0dHk3WnpVbkoxMDRGRmdTaG9EOUlpc0l5cTktQm9UQTM0MC1yZVljSEVLOWxfcm5GSXZrZ3VjdnJxWkZDWG52V2xibw?oc=5,2025-06-07 06:23:39,Times Bull,"<a href=""https://news.google.com/rss/articles/CBMiswFBVV95cUxNbld6WXJIWldlQ281UVR4V2l6YXFuWU1GZUpaM00wOWdBRjd4MGszTmxySkpFdWJ5RjFDQS1tc0VvSXJnUGtnUTNMbnY0c3VDTXFMVGExbjdiUTFZS2xhZkM0bTBKU3dHdHk4b3JGbmc0dHk3WnpVbkoxMDRGRmdTaG9EOUlpc0l5cTktQm9UQTM0MC1yZVljSEVLOWxfcm5GSXZrZ3VjdnJxWkZDWG52V2xibw?oc=5"" target=""_blank"">Monsoon Update: Meteorological Department issued heavy rain warning in 12 states</a>&nbsp;&nbsp;<font color=""#6f6f6f"">Times Bull</font>",Monsoon,en
"Weather: दिल्ली समेत पूरे उत्तर भारत में कहर बरपाएगी गर्मी, केरल में भारी बारिश; राजस्थान में 40 के पार जाएगा तापमान - Weather Update North India heatwave summer Forecast IMD Delhi NCR to UP Bihar Haryana Punjab - Jagran",https://news.google.com/rss/articles/CBMi8gFBVV95cUxOV21LWjA0TmFsYUYzWjE4MS1wcllUODVTS0lZSEdValNhZTloemU0VEdZb2N0cmdKWU0xbUNscTF1VHhYQ1lGeGJuUUdlVlNiMXM1bGtWaDVveXNaU3h5Rlg5ejBjU0d4QkhCcFBrMTJVUGJ6U1JVZUNjemtXUWNaU3FHUW9FYm9qdGFRVERKUGRRcEZwcnVQcmJNS1JZeXlsVVVndmZ3RV9wM0NJNk1nSFA2aEUyUGRFejl6a1EwV2pqV184ZGp3NHFDRC1WdEk2S21ZUXMtM0l2UW9FUGlWMFBJeWlGX1ZkTTBFM3hsNFRJQQ?oc=5,2025-06-07 06:15:00,Jagran,"<a href=""https://news.google.com/rss/articles/CBMi8gFBVV95cUxOV21LWjA0TmFsYUYzWjE4MS1wcllUODVTS0lZSEdValNhZTloemU0VEdZb2N0cmdKWU0xbUNscTF1VHhYQ1lGeGJuUUdlVlNiMXM1bGtWaDVveXNaU3h5Rlg5ejBjU0d4QkhCcFBrMTJVUGJ6U1JVZUNjemtXUWNaU3FHUW9FYm9qdGFRVERKUGRRcEZwcnVQcmJNS1JZeXlsVVVndmZ3RV9wM0NJNk1nSFA2aEUyUGRFejl6a1EwV2pqV184ZGp3NHFDRC1WdEk2S21ZUXMtM0l2UW9FUGlWMFBJeWlGX1ZkTTBFM3hsNFRJQQ?oc=5"" target=""_blank"">Weather: दिल्ली समेत पूरे उत्तर भारत में कहर बरपाएगी गर्मी, केरल में भारी बारिश; राजस्थान में 40 के पार जाएगा तापमान - Weather Update North India heatwave summer Forecast IMD Delhi NCR to UP Bihar Haryana Punjab</a>&nbsp;&nbsp;<font color=""#6f6f6f"">Jagran</font>",Monsoon,hi
"दिल्ली समेत पूरे उत्तर भारत में कहर बरपाएगी गर्मी, केरल में भारी बारिश; राजस्थान में 40 के पार जाएगा तापमान - 24CityNews",https://news.google.com/rss/articles/CBMizAFBVV95cUxOVWhweE1MazQ2UnlUUjRtQU5nLW5URTc2X21pZXo2UXpzZk5kb3g5SXd0Q3Q0TFMxWV8ycjlfTUZEVnJfdHJHQWR3MlMxdGx2SzRJMEUxNUt5eWJoQ1gwWE9JN2ZPZUhsaE5UZkhrR2dqNWcxSE1LQ2VuYXF0aUxrcnBQemUxM0d4N2xFXzA5eEdmRFg1alVBN0phdVQtZVdnbGdkRDFpbklYUnJPYU9SN0tIRk0taFl3S1g4UUsxUElWdXVDUGEyR0V6YlQ?oc=5,2025-06-07 08:04:05,24CityNews,"<a href=""https://news.google.com/rss/articles/CBMizAFBVV95cUxOVWhweE1MazQ2UnlUUjRtQU5nLW5URTc2X21pZXo2UXpzZk5kb3g5SXd0Q3Q0TFMxWV8ycjlfTUZEVnJfdHJHQWR3MlMxdGx2SzRJMEUxNUt5eWJoQ1gwWE9JN2ZPZUhsaE5UZkhrR2dqNWcxSE1LQ2VuYXF0aUxrcnBQemUxM0d4N2xFXzA5eEdmRFg1alVBN0phdVQtZVdnbGdkRDFpbklYUnJPYU9SN0tIRk0taFl3S1g4UUsxUElWdXVDUGEyR0V6YlQ?oc=5"" target=""_blank"">दिल्ली समेत पूरे उत्तर भारत में कहर बरपाएगी गर्मी, केरल में भारी बारिश; राजस्थान में 40 के पार जाएगा तापमान</a>&nbsp;&nbsp;<font color=""#6f6f6f"">24CityNews</font>",Monsoon,hi
