Title,Link,Date,Source,Summary,Term,LanguageQueried
"Punjab Weather : ਭਾਰੀ ਮੀਂਹ ਕਾਰਨ ਪਠਾਨਕੋਟ-ਚੰਬਾ ਨੈਸ਼ਨਲ ਹਾਈਵੇਅ 'ਤੇ ਧਸੀ ਸੜਕ, ਆਵਾਜਾਈ ਬੰਦ, ਅਗਲੇ ਤਿੰਨ ਦਿਨ ਲਈ ਯੈਲੋ ਅਲਰਟ - Due to heavy rains road washed away on Pathankot Chamba National Highway traffic stopped yellow alert for n - punjabijagran.com",https://news.google.com/rss/articles/CBMijAJBVV95cUxPR0VkZWZ5YndfWG1JRVdjbkoxN2NIalB1ZzBVOVl5cEJSczhZVUtxNXRRM0otdEM5YmpJQ2FZd2MtdXFtUnVUTEp3V1AxeHlKaTBQYi14TElxbVZOTE13RVBNbTlwUnJGUkVxeFZIN1BqUy1OcTU3SDBZalVzaXJaVnQzSGV2RDlNa3hyekpRbEJ1RjQzNnZhbXNkaVI3bUNPeUp1VzFxbHZDYW96RmZUTWNaVDJYVmVYT3cyUmdyakdfaE9sdnZ3dHNUclRPLWFUUm9zeGdfUExscEpfVWJnUEE0dk9ZNzRsdUZhUFJVam1ILWRodTFGb3VWYUxra1Q4QXRTMVV3NDRFd1RG?oc=5,2025-08-12 09:28:00,punjabijagran.com,"<a href=""https://news.google.com/rss/articles/CBMijAJBVV95cUxPR0VkZWZ5YndfWG1JRVdjbkoxN2NIalB1ZzBVOVl5cEJSczhZVUtxNXRRM0otdEM5YmpJQ2FZd2MtdXFtUnVUTEp3V1AxeHlKaTBQYi14TElxbVZOTE13RVBNbTlwUnJGUkVxeFZIN1BqUy1OcTU3SDBZalVzaXJaVnQzSGV2RDlNa3hyekpRbEJ1RjQzNnZhbXNkaVI3bUNPeUp1VzFxbHZDYW96RmZUTWNaVDJYVmVYT3cyUmdyakdfaE9sdnZ3dHNUclRPLWFUUm9zeGdfUExscEpfVWJnUEE0dk9ZNzRsdUZhUFJVam1ILWRodTFGb3VWYUxra1Q4QXRTMVV3NDRFd1RG?oc=5"" target=""_blank"">Punjab Weather : ਭਾਰੀ ਮੀਂਹ ਕਾਰਨ ਪਠਾਨਕੋਟ-ਚੰਬਾ ਨੈਸ਼ਨਲ ਹਾਈਵੇਅ 'ਤੇ ਧਸੀ ਸੜਕ, ਆਵਾਜਾਈ ਬੰਦ, ਅਗਲੇ ਤਿੰਨ ਦਿਨ ਲਈ ਯੈਲੋ ਅਲਰਟ - Due to heavy rains road washed away on Pathankot Chamba National Highway traffic stopped yellow alert for n</a>&nbsp;&nbsp;<font color=""#6f6f6f"">punjabijagran.com</font>",Monsoon,pa
"ਆਪ ਸਰਕਾਰ ਹੜ੍ਹ ਪ੍ਰਬੰਧਨ ’ਚ ਫੇਲ੍ਹ, ਹਜ਼ਾਰਾਂ ਏਕੜ ਫ਼ਸਲ ਤਬਾਹ, ਕਿਸਾਨਾਂ ਨੂੰ ਤੁਰੰਤ ਮੁਆਵਜ਼ਾ ਦੇਵੇ ਸਰਕਾਰ : ਪਦਮਸ੍ਰੀ ਪਰਗਟ ਸਿੰਘ - AAP government failed in flood management, thousands of acres of crops destroyed, government should im - punjabijagran.com",https://news.google.com/rss/articles/CBMitwJBVV95cUxQMEVpYWloeFV1bUJaLWVvRTRXbnpOUUFCZXFPRWl6dmE2dmtFRWdtZ1k3aGNtakxGSVNrS2V3RVhZRVZ3eXhLWmc0QlFxSXlwTVR5bUNtLXFDYUp4d3ZDdGtYdnVXeE04ME5yYXVnUVViOGt5MWNnQTlfZ0VvTHZjbV9KQXQ4cFVpb2p5bU1kSVFCdkdyN2w1bkoxbVZDS04zbTBnclBvU25vR2JrM2pJOXpQRVpQb3E4cFBJejRxZmVLbkRlbFhNMTFNQmxJaEgwRlFmM3piUVd3cFVQYk9HVmdCV2dnU0dGWk1jemtKYnVFOXk1YWlxVk5Ndy1qMHZVUEJJdlUzc1l0RUxpVnpmYWJhX2Z0MHBBSUc5YWRWMS1wU0pXaDQzRHlvZXB2a0F4MUtpNDR2QQ?oc=5,2025-08-12 04:06:00,punjabijagran.com,"<a href=""https://news.google.com/rss/articles/CBMitwJBVV95cUxQMEVpYWloeFV1bUJaLWVvRTRXbnpOUUFCZXFPRWl6dmE2dmtFRWdtZ1k3aGNtakxGSVNrS2V3RVhZRVZ3eXhLWmc0QlFxSXlwTVR5bUNtLXFDYUp4d3ZDdGtYdnVXeE04ME5yYXVnUVViOGt5MWNnQTlfZ0VvTHZjbV9KQXQ4cFVpb2p5bU1kSVFCdkdyN2w1bkoxbVZDS04zbTBnclBvU25vR2JrM2pJOXpQRVpQb3E4cFBJejRxZmVLbkRlbFhNMTFNQmxJaEgwRlFmM3piUVd3cFVQYk9HVmdCV2dnU0dGWk1jemtKYnVFOXk1YWlxVk5Ndy1qMHZVUEJJdlUzc1l0RUxpVnpmYWJhX2Z0MHBBSUc5YWRWMS1wU0pXaDQzRHlvZXB2a0F4MUtpNDR2QQ?oc=5"" target=""_blank"">ਆਪ ਸਰਕਾਰ ਹੜ੍ਹ ਪ੍ਰਬੰਧਨ ’ਚ ਫੇਲ੍ਹ, ਹਜ਼ਾਰਾਂ ਏਕੜ ਫ਼ਸਲ ਤਬਾਹ, ਕਿਸਾਨਾਂ ਨੂੰ ਤੁਰੰਤ ਮੁਆਵਜ਼ਾ ਦੇਵੇ ਸਰਕਾਰ : ਪਦਮਸ੍ਰੀ ਪਰਗਟ ਸਿੰਘ - AAP government failed in flood management, thousands of acres of crops destroyed, government should im</a>&nbsp;&nbsp;<font color=""#6f6f6f"">punjabijagran.com</font>",Monsoon,pa
Lahore (TNS) PDMA issues flood advisory as monsoon rains expected in Punjab from August 131 - tns.world,https://news.google.com/rss/articles/CBMiQEFVX3lxTE0wQ29Nb1NEdk0yS2QtVGZxdDFRNlBrZzFjSFExUTZRMjVobVFDdU1IOVlFNFlGYjl6OFVYZ2Iyd1I?oc=5,2025-08-12 10:34:27,tns.world,"<a href=""https://news.google.com/rss/articles/CBMiQEFVX3lxTE0wQ29Nb1NEdk0yS2QtVGZxdDFRNlBrZzFjSFExUTZRMjVobVFDdU1IOVlFNFlGYjl6OFVYZ2Iyd1I?oc=5"" target=""_blank"">Lahore (TNS) PDMA issues flood advisory as monsoon rains expected in Punjab from August 131</a>&nbsp;&nbsp;<font color=""#6f6f6f"">tns.world</font>",Monsoon,en
PDMA issues flood advisory as Punjab braces for 7th monsoon spell - Daily Times,https://news.google.com/rss/articles/CBMiogFBVV95cUxQVVJBZjJuLXpyd0VkRDF4SFdoei1YWXUtVEtTbnlCSW5KaTVNWnA5eXoyRjdCWElWSmtJM1dWcHRMMjFlZ0Y1NlB1aWRHa0xTOGFkdkhXcG5GSW1YcV9PdjlPdDRaXzkxS2UzN3ZVWHdqTG1hbjlqVXJ5bW1tYk82eHFzRHpFZ1VxTXdxX1MtSXNtc1JjQVlhOFlqWnZtcTV3bVHSAacBQVVfeXFMT00tei1PUzJiV2NDZkdBNW95ckdKa3RDTDBzYWd3Vno5VzJqVVl4OEFEQWNpUWtoNW5uNTZwTzg5azJlSFQ0WVZkMjNNYUk5a2FBOGsyV3ctaVd0TkZmWEQ4amdtbWFLaGxCQWo1QWgxVFJEMzZ2STdUV2NoRGYzQ2x4SUFxTTlEZ3R2TGRad1h0aVA5NFVjSWluZXdYaHVjbWI4cHVBZFU?oc=5,2025-08-12 03:06:47,Daily Times,"<a href=""https://news.google.com/rss/articles/CBMiogFBVV95cUxQVVJBZjJuLXpyd0VkRDF4SFdoei1YWXUtVEtTbnlCSW5KaTVNWnA5eXoyRjdCWElWSmtJM1dWcHRMMjFlZ0Y1NlB1aWRHa0xTOGFkdkhXcG5GSW1YcV9PdjlPdDRaXzkxS2UzN3ZVWHdqTG1hbjlqVXJ5bW1tYk82eHFzRHpFZ1VxTXdxX1MtSXNtc1JjQVlhOFlqWnZtcTV3bVHSAacBQVVfeXFMT00tei1PUzJiV2NDZkdBNW95ckdKa3RDTDBzYWd3Vno5VzJqVVl4OEFEQWNpUWtoNW5uNTZwTzg5azJlSFQ0WVZkMjNNYUk5a2FBOGsyV3ctaVd0TkZmWEQ4amdtbWFLaGxCQWo1QWgxVFJEMzZ2STdUV2NoRGYzQ2x4SUFxTTlEZ3R2TGRad1h0aVA5NFVjSWluZXdYaHVjbWI4cHVBZFU?oc=5"" target=""_blank"">PDMA issues flood advisory as Punjab braces for 7th monsoon spell</a>&nbsp;&nbsp;<font color=""#6f6f6f"">Daily Times</font>",Monsoon,en
Dharali-Harsil road connectivity to be restored within 3 days after cloudburst damage: BRO chief - DD News,https://news.google.com/rss/articles/CBMivgFBVV95cUxPM0JHZExQVTdSRV9NUG1WaXNPWUhtcnNQTVFGa2dYdmhFMFZXS3FZZXdPVm91VWFYSVRYdl9IRXdFSXpBcHdSU0pOSkhsY2RhNGN0UGlvTU5wWE0zRHVremJJOEwzRXBBVHZaSFdYbU9KUVRnRlpmQlJfN1ljWkowTVJhSjlTODBhQ1VDcERZc0llVnpjR21zeFptQVBLdUhmRnhkbVl6ejdudjJWS2RRemhlMHdzbERYclNvU29B?oc=5,2025-08-12 01:04:43,DD News,"<a href=""https://news.google.com/rss/articles/CBMivgFBVV95cUxPM0JHZExQVTdSRV9NUG1WaXNPWUhtcnNQTVFGa2dYdmhFMFZXS3FZZXdPVm91VWFYSVRYdl9IRXdFSXpBcHdSU0pOSkhsY2RhNGN0UGlvTU5wWE0zRHVremJJOEwzRXBBVHZaSFdYbU9KUVRnRlpmQlJfN1ljWkowTVJhSjlTODBhQ1VDcERZc0llVnpjR21zeFptQVBLdUhmRnhkbVl6ejdudjJWS2RRemhlMHdzbERYclNvU29B?oc=5"" target=""_blank"">Dharali-Harsil road connectivity to be restored within 3 days after cloudburst damage: BRO chief</a>&nbsp;&nbsp;<font color=""#6f6f6f"">DD News</font>",Monsoon,en
"Punjab: Swollen Beas floods 20 villages in mand area, 4k acres submerged - Hindustan Times",https://news.google.com/rss/articles/CBMi3gFBVV95cUxObVRoMVRrTUdyTU5jUFVxejNXUS02TkpWYWhHTHBJR29zUVk5bHFCNHRFV0VsbzFhZ2RDOERtY0tXSVJOdHRnc2pKQS1odTh4MVRhX3EtUzBEVEtOZ0toWE9WMHRHS1dKN2ptcFVTZ2NKeXBqb1JLVjJ1S0dsTkhURk1mNlROU2xpT1RDbVJxeFNQVWNHUzN2b1NTak5pZld6dmdaSzg4dHBLT29yOVF2WC1wR2dsWFE3VjlqLXYxcWZRWjQxSWlGTFRSbnBSS0JZUVJxaU43NWNKMmstakE?oc=5,2025-08-12 05:54:08,Hindustan Times,"<a href=""https://news.google.com/rss/articles/CBMi3gFBVV95cUxObVRoMVRrTUdyTU5jUFVxejNXUS02TkpWYWhHTHBJR29zUVk5bHFCNHRFV0VsbzFhZ2RDOERtY0tXSVJOdHRnc2pKQS1odTh4MVRhX3EtUzBEVEtOZ0toWE9WMHRHS1dKN2ptcFVTZ2NKeXBqb1JLVjJ1S0dsTkhURk1mNlROU2xpT1RDbVJxeFNQVWNHUzN2b1NTak5pZld6dmdaSzg4dHBLT29yOVF2WC1wR2dsWFE3VjlqLXYxcWZRWjQxSWlGTFRSbnBSS0JZUVJxaU43NWNKMmstakE?oc=5"" target=""_blank"">Punjab: Swollen Beas floods 20 villages in mand area, 4k acres submerged</a>&nbsp;&nbsp;<font color=""#6f6f6f"">Hindustan Times</font>",Monsoon,en
Chenab flood alert issued for Punjab districts - Minute Mirror,https://news.google.com/rss/articles/CBMiigFBVV95cUxNdWFCZkVzWXphM0Z5Q1NkTkNJX3dibmJhV2dJMDR5SnZER0xBN3BLUWpyeGZhR055cEVQRUtHaFdETG9HVV9XdUR2ZlpTMnoyTDVvS3R0NFFkTkotZFJPazU4TlJTRkREOGZjZVFOU1I2aWVBY1hUQlR3aGhlSmZneGU0TXg4N1U3S1E?oc=5,2025-08-12 10:04:20,Minute Mirror,"<a href=""https://news.google.com/rss/articles/CBMiigFBVV95cUxNdWFCZkVzWXphM0Z5Q1NkTkNJX3dibmJhV2dJMDR5SnZER0xBN3BLUWpyeGZhR055cEVQRUtHaFdETG9HVV9XdUR2ZlpTMnoyTDVvS3R0NFFkTkotZFJPazU4TlJTRkREOGZjZVFOU1I2aWVBY1hUQlR3aGhlSmZneGU0TXg4N1U3S1E?oc=5"" target=""_blank"">Chenab flood alert issued for Punjab districts</a>&nbsp;&nbsp;<font color=""#6f6f6f"">Minute Mirror</font>",Monsoon,en
"Punjab weather: पंजाब में बदला मौसम, कई जिलों में हुई बारिश; कल से तीन दिनों तक भारी वर्षा की चेतावनी जारी - Punjab weather Heavy rain expected for three days from 13 august rain occurred many districts including Chandiga - Jagran",https://news.google.com/rss/articles/CBMijwJBVV95cUxPbjhkM0dyM3oxNXp6RV9OTE1LOGk1Q0U2a2JHQ0ZhQ080REtzRldUM1EtMlMzeF9Ld3U3WDJYdVAtcXhvVklpdnc1YVgyM0NjbXlubTNGdUt3NkpXT0o5NFdNZnFxQWRRbC1OSm96d0g0SlN2U3k3OVRha2FtdlFzd1ptc2E5d09XYjJVdHhwakFiNkZfeTVtUGpIbEtKNGpvYkh3MVRxSElpQWk5UXlWbVFuZEI4bGpwYmNzZGpCZE5uUXNSdXN0QWhYT1Fob0F6cHljNGtkZXdvNU92aF9ZOTBnZUZJWnRXblVBYi1JbHhGVnlfZWFDYkhqbEc5QVpfRG9aTTVWbjBOR2pFNU80?oc=5,2025-08-12 07:55:00,Jagran,"<a href=""https://news.google.com/rss/articles/CBMijwJBVV95cUxPbjhkM0dyM3oxNXp6RV9OTE1LOGk1Q0U2a2JHQ0ZhQ080REtzRldUM1EtMlMzeF9Ld3U3WDJYdVAtcXhvVklpdnc1YVgyM0NjbXlubTNGdUt3NkpXT0o5NFdNZnFxQWRRbC1OSm96d0g0SlN2U3k3OVRha2FtdlFzd1ptc2E5d09XYjJVdHhwakFiNkZfeTVtUGpIbEtKNGpvYkh3MVRxSElpQWk5UXlWbVFuZEI4bGpwYmNzZGpCZE5uUXNSdXN0QWhYT1Fob0F6cHljNGtkZXdvNU92aF9ZOTBnZUZJWnRXblVBYi1JbHhGVnlfZWFDYkhqbEc5QVpfRG9aTTVWbjBOR2pFNU80?oc=5"" target=""_blank"">Punjab weather: पंजाब में बदला मौसम, कई जिलों में हुई बारिश; कल से तीन दिनों तक भारी वर्षा की चेतावनी जारी - Punjab weather Heavy rain expected for three days from 13 august rain occurred many districts including Chandiga</a>&nbsp;&nbsp;<font color=""#6f6f6f"">Jagran</font>",Monsoon,hi
